{
  "snapshot_id": "EMBRAPA-INFOTECA-748767-METADATA:bb022f906cc311a9fa98546257a1e85cb073082ba0df9cc4feede6718de7b901",
  "source_id": "EMBRAPA-INFOTECA-748767-METADATA",
  "original_url": "https://www.infoteca.cnptia.embrapa.br/handle/doc/748767",
  "final_url": "https://www.infoteca.cnptia.embrapa.br/handle/doc/748767",
  "retrieved_at": "2026-10-02T00:06:47.333899+00:00",
  "content_hash": "bb022f906cc311a9fa98546257a1e85cb073082ba0df9cc4feede6718de7b901",
  "mime_type": "text/html; charset=UTF-8",
  "file_size": 21698,
  "document_title": "Infoteca-e record — Colheita e pós-colheita",
  "institution": "Embrapa Infoteca-e",
  "publication_date": "2026-10-01",
  "document_version": "Embrapa Infoteca-e; repository metadata page, retrieved 2026-10-01",
  "license_status": "UNKNOWN",
  "license_evidence_url": "https://www.infoteca.cnptia.embrapa.br/handle/doc/748767",
  "license_evidence_note": "Frozen repository metadata record; text explicitly identifies CC BY-NC-ND 4.0. It does not establish permission to redistribute in this application.",
  "filename": "iafarm-license-harvest.html",
  "acquisition_method": "PowerShell HttpClient GET; HTTP 200; response bytes saved and SHA-256 verified",
  "local_path": "EMBRAPA-INFOTECA-748767-METADATA/bb022f906cc311a9fa98546257a1e85cb073082ba0df9cc4feede6718de7b901.blob",
  "snapshot_status": "CAPTURED",
  "previous_snapshot_hashes": []
}
