{
  "snapshot_id": "EMBRAPA-MILHO-COLHEITA-2015:6bb59370e56c58cde9bf9fc5e10ec76298daea837d02188e37d178eadab3a981",
  "source_id": "EMBRAPA-MILHO-COLHEITA-2015",
  "original_url": "https://www.infoteca.cnptia.embrapa.br/infoteca/bitstream/doc/748767/1/Milho-Colheita-e-pos-colheita.pdf",
  "final_url": "https://www.infoteca.cnptia.embrapa.br/infoteca/bitstream/doc/748767/1/Milho-Colheita-e-pos-colheita.pdf",
  "retrieved_at": "2026-10-02T00:04:38.038920+00:00",
  "content_hash": "6bb59370e56c58cde9bf9fc5e10ec76298daea837d02188e37d178eadab3a981",
  "mime_type": "application/pdf",
  "file_size": 2511368,
  "document_title": "Cultivo do Milho — Colheita e pós-colheita",
  "institution": "Embrapa Milho e Sorgo",
  "publication_date": "2015-11",
  "document_version": "Sistema de Produção 1, 9ª edição eletrônica; Nov/2015",
  "license_status": "RESTRICTED",
  "license_evidence_url": "https://www.infoteca.cnptia.embrapa.br/handle/doc/748767",
  "license_evidence_note": "Infoteca displays CC BY-NC-ND 4.0; permission to redistribute or adapt in this application not established.",
  "filename": "iafarm-harvest-2015.pdf",
  "acquisition_method": "PowerShell HttpClient GET; HTTP 200; response bytes saved and SHA-256 verified",
  "local_path": "EMBRAPA-MILHO-COLHEITA-2015/6bb59370e56c58cde9bf9fc5e10ec76298daea837d02188e37d178eadab3a981.blob",
  "snapshot_status": "CAPTURED",
  "previous_snapshot_hashes": []
}
