{
  "snapshot_id": "EMBRAPA-INFOTECA-749082-METADATA:532400f62ee000087baa8a0bfbf4744a6e799f37cc724209568957575ae18795",
  "source_id": "EMBRAPA-INFOTECA-749082-METADATA",
  "original_url": "https://www.infoteca.cnptia.embrapa.br/handle/doc/749082",
  "final_url": "https://www.infoteca.cnptia.embrapa.br/handle/doc/749082",
  "retrieved_at": "2026-10-02T00:06:47.304779+00:00",
  "content_hash": "532400f62ee000087baa8a0bfbf4744a6e799f37cc724209568957575ae18795",
  "mime_type": "text/html; charset=UTF-8",
  "file_size": 21508,
  "document_title": "Infoteca-e record — Manejo de solos",
  "institution": "Embrapa Infoteca-e",
  "publication_date": "2026-10-01",
  "document_version": "Embrapa Infoteca-e; repository metadata page, retrieved 2026-10-01",
  "license_status": "UNKNOWN",
  "license_evidence_url": "https://www.infoteca.cnptia.embrapa.br/handle/doc/749082",
  "license_evidence_note": "Frozen repository metadata record; text explicitly identifies CC BY-NC-ND 4.0. It does not establish permission to redistribute in this application.",
  "filename": "iafarm-license-soil.html",
  "acquisition_method": "PowerShell HttpClient GET; HTTP 200; response bytes saved and SHA-256 verified",
  "local_path": "EMBRAPA-INFOTECA-749082-METADATA/532400f62ee000087baa8a0bfbf4744a6e799f37cc724209568957575ae18795.blob",
  "snapshot_status": "CAPTURED",
  "previous_snapshot_hashes": []
}
