{
  "snapshot_id": "EMBRAPA-MILHO-FERTILIDADE-2015:f299e4312aed63ca3e05af12d70c8a7cf6b3eb366a8d9023ac93483d1d71152a",
  "source_id": "EMBRAPA-MILHO-FERTILIDADE-2015",
  "original_url": "https://www.infoteca.cnptia.embrapa.br/infoteca/bitstream/doc/749175/1/Milho-Fertilidade-de-solos-e-adubacao.pdf",
  "final_url": "https://www.infoteca.cnptia.embrapa.br/infoteca/bitstream/doc/749175/1/Milho-Fertilidade-de-solos-e-adubacao.pdf",
  "retrieved_at": "2026-10-02T00:04:37.992510+00:00",
  "content_hash": "f299e4312aed63ca3e05af12d70c8a7cf6b3eb366a8d9023ac93483d1d71152a",
  "mime_type": "application/pdf",
  "file_size": 1937244,
  "document_title": "Cultivo do Milho — Fertilidade de solos e adubação",
  "institution": "Embrapa Milho e Sorgo",
  "publication_date": "2015-11",
  "document_version": "Sistema de Produção 1, 9ª edição eletrônica; Nov/2015",
  "license_status": "RESTRICTED",
  "license_evidence_url": "https://www.infoteca.cnptia.embrapa.br/handle/doc/749175",
  "license_evidence_note": "Infoteca displays CC BY-NC-ND 4.0; permission to redistribute or adapt in this application not established.",
  "filename": "iafarm-fertility-2015.pdf",
  "acquisition_method": "PowerShell HttpClient GET; HTTP 200; response bytes saved and SHA-256 verified",
  "local_path": "EMBRAPA-MILHO-FERTILIDADE-2015/f299e4312aed63ca3e05af12d70c8a7cf6b3eb366a8d9023ac93483d1d71152a.blob",
  "snapshot_status": "CAPTURED",
  "previous_snapshot_hashes": []
}
