{
  "snapshot_id": "EMBRAPA-FISIOLOGIA-MILHO-2006:2f6bb2b13f4d6694450c96e9b5b4dcf848558a5fda282d6766b51577fd4ad18d",
  "source_id": "EMBRAPA-FISIOLOGIA-MILHO-2006",
  "original_url": "https://www.infoteca.cnptia.embrapa.br/infoteca/bitstream/doc/490408/1/Circ76.pdf",
  "final_url": "https://www.infoteca.cnptia.embrapa.br/infoteca/bitstream/doc/490408/1/Circ76.pdf",
  "retrieved_at": "2026-10-02T00:04:38.021619+00:00",
  "content_hash": "2f6bb2b13f4d6694450c96e9b5b4dcf848558a5fda282d6766b51577fd4ad18d",
  "mime_type": "application/pdf",
  "file_size": 230090,
  "document_title": "Fisiologia da Produção de Milho — Circular Técnica 76",
  "institution": "Embrapa Milho e Sorgo",
  "publication_date": "2006-12",
  "document_version": "Circular Técnica 76; dezembro de 2006",
  "license_status": "RESTRICTED",
  "license_evidence_url": "https://www.infoteca.cnptia.embrapa.br/handle/doc/490408",
  "license_evidence_note": "Infoteca displays CC BY-NC-ND 4.0; permission to redistribute or adapt in this application not established.",
  "filename": "iafarm-phenology-2006.pdf",
  "acquisition_method": "PowerShell HttpClient GET; HTTP 200; response bytes saved and SHA-256 verified",
  "local_path": "EMBRAPA-FISIOLOGIA-MILHO-2006/2f6bb2b13f4d6694450c96e9b5b4dcf848558a5fda282d6766b51577fd4ad18d.blob",
  "snapshot_status": "CAPTURED",
  "previous_snapshot_hashes": []
}
